{
  "schema_version": "2.0.0",
  "dataset_version": "0.3.0",
  "published_at": "2026-08-30",
  "author": "Jinkai Liu｜劉金凱",
  "classification_model": {
    "package": "G.1",
    "version": "0.1",
    "principle": "One English word → one primary Chinese mapping → separate historical etymology → separate sound-semantic hypothesis → separate experimental validation.",
    "review_rule": "Source Verification and AI Review target each object independently. No G.1 calibration object is automatically Reviewed or Published."
  },
  "lifecycle": {
    "stages": [
      "candidate",
      "reviewed",
      "published"
    ],
    "promotion_rule": "AI may extract candidate records, but only documented human or research review may promote evidence level, confidence, experiment status or publication status."
  },
  "sources": [
    {
      "source_id": "SRC-LB-SKY",
      "title": "Language Book · Sky",
      "source_type": "language-book-page",
      "path": "words/sky.html",
      "version": "1.5",
      "notes": "Project-authored bilingual page; established facts and experimental mappings remain separately labelled."
    },
    {
      "source_id": "SRC-LB-UNIVERSE",
      "title": "Language Book · Universe",
      "source_type": "language-book-page",
      "path": "words/universe.html",
      "version": "1.1",
      "notes": "Project-authored bilingual multidimensional mapping case."
    },
    {
      "source_id": "SRC-LB-MAN",
      "title": "Language Book · Man",
      "source_type": "language-book-page",
      "path": "words/man.html",
      "version": "0.2",
      "notes": "Project-authored experimental mapping-score case; score is provisional and not historically calibrated."
    },
    {
      "source_id": "SRC-PROTOCOL-MAPPING",
      "title": "Protocol Book · Multidimensional Mapping Framework",
      "source_type": "protocol-page",
      "path": "protocol/protocol.mapping-framework.html",
      "version": "current",
      "notes": "Defines mapping mechanisms and evidence boundaries used by the source pages."
    },
    {
      "source_id": "SRC-HYPOTHESIS-LAB",
      "title": "Unilanguage Hypothesis Lab",
      "source_type": "project-documentation",
      "path": "hypothesis-lab.html",
      "version": "2026-08-29",
      "notes": "Registry for experimental hypotheses and evaluation records."
    },
    {
      "source_id": "SRC-EXP-002-PRIMARY",
      "title": "UNI-EXP-002 frozen primary result",
      "source_type": "frozen-experiment",
      "path": "experiments/002/results/primary-result.v1.0.json",
      "version": "1.0 FROZEN",
      "notes": "Machine-readable primary result. This source and its frozen statistics must not be modified by the product dataset."
    },
    {
      "source_id": "SRC-EXP-002-PAGE",
      "title": "UNI-EXP-002 public result page",
      "source_type": "frozen-experiment",
      "path": "experiments/002/results.html",
      "version": "Result Freeze v1.0",
      "notes": "Public bilingual result page."
    },
    {
      "source_id": "SRC-LB-LANGUAGE",
      "title": "Language Book · Language",
      "source_type": "language-book-page",
      "path": "words/language.html",
      "version": "current project edition",
      "notes": "Project-authored multilingual word page. Package E publishes only its ordinary lexical mapping and established lexical-history boundary; exploratory sound associations remain outside the canonical record."
    },
    {
      "source_id": "SRC-LB-SOUND",
      "title": "Language Book · Sound",
      "source_type": "language-book-page",
      "path": "words/sound.html",
      "version": "current project edition",
      "notes": "Project-authored multilingual word page. Package E publishes only ordinary lexical equivalents; proposed sound-pattern claims remain outside the canonical record."
    },
    {
      "source_id": "SRC-G1-CALIBRATION",
      "title": "Package G.1 WATER / LANGUAGE author calibration record",
      "source_type": "author-research-record",
      "path": "docs/product/package-g1-classification-model-v0.1.md",
      "version": "0.1",
      "notes": "Records author proposals as research inputs, not as independently verified linguistic facts."
    }
  ],
  "hypotheses": [
    {
      "hypothesis_id": "UNI-SKY-COVER-001",
      "label": {
        "en": "sky ↔ 盖 as a phonetic-semantic and cognitive candidate",
        "zh-Hans": "sky ↔ 盖：语音—语义与认知候选映射"
      },
      "status": "Untested",
      "source_refs": [
        "SRC-LB-SKY",
        "SRC-PROTOCOL-MAPPING"
      ],
      "hypothesis_type": "sound-semantic",
      "identity": "author-hypothesis",
      "statement": {
        "en": "sky ↔ 盖 as a phonetic-semantic and cognitive candidate",
        "zh-Hans": "sky ↔ 盖：语音—语义与认知候选映射"
      },
      "evidence_refs": [
        "SRC-LB-SKY",
        "SRC-PROTOCOL-MAPPING"
      ],
      "confidence": "low",
      "source_verification": {
        "status": "needs-verification",
        "source_refs": [
          "SRC-LB-SKY",
          "SRC-PROTOCOL-MAPPING"
        ],
        "notes": {
          "en": "Migrated from the v0.2 hypothesis registry as an independent hypothesis object.",
          "zh-Hans": "从 v0.2 假说登记表迁移为独立假说对象。"
        }
      },
      "ai_review": {
        "status": "not-reviewed",
        "reviewer": null,
        "reviewed_at": null,
        "rationale": {
          "en": "No G.1 object-level AI review has been completed.",
          "zh-Hans": "尚未完成 G.1 对象级 AI 审核。"
        }
      }
    },
    {
      "hypothesis_id": "UNI-UNIVERSE-FLOW-001",
      "label": {
        "en": "Selected universe / 宇宙 sound and continuity sub-mappings",
        "zh-Hans": "universe／宇宙的声音与连续性子映射"
      },
      "status": "Untested",
      "source_refs": [
        "SRC-LB-UNIVERSE",
        "SRC-PROTOCOL-MAPPING"
      ],
      "hypothesis_type": "sound-semantic",
      "identity": "author-hypothesis",
      "statement": {
        "en": "Selected universe / 宇宙 sound and continuity sub-mappings",
        "zh-Hans": "universe／宇宙的声音与连续性子映射"
      },
      "evidence_refs": [
        "SRC-LB-UNIVERSE",
        "SRC-PROTOCOL-MAPPING"
      ],
      "confidence": "low",
      "source_verification": {
        "status": "needs-verification",
        "source_refs": [
          "SRC-LB-UNIVERSE",
          "SRC-PROTOCOL-MAPPING"
        ],
        "notes": {
          "en": "Migrated from the v0.2 hypothesis registry as an independent hypothesis object.",
          "zh-Hans": "从 v0.2 假说登记表迁移为独立假说对象。"
        }
      },
      "ai_review": {
        "status": "not-reviewed",
        "reviewer": null,
        "reviewed_at": null,
        "rationale": {
          "en": "No G.1 object-level AI review has been completed.",
          "zh-Hans": "尚未完成 G.1 对象级 AI 审核。"
        }
      }
    },
    {
      "hypothesis_id": "UNI-SOUND-MN-001",
      "label": {
        "en": "M–N correspondence hypothesis",
        "zh-Hans": "M–N 对应假说"
      },
      "status": "Untested",
      "source_refs": [
        "SRC-LB-MAN",
        "SRC-HYPOTHESIS-LAB"
      ],
      "hypothesis_type": "sound-semantic",
      "identity": "author-hypothesis",
      "statement": {
        "en": "M–N correspondence hypothesis",
        "zh-Hans": "M–N 对应假说"
      },
      "evidence_refs": [
        "SRC-LB-MAN",
        "SRC-HYPOTHESIS-LAB"
      ],
      "confidence": "low",
      "source_verification": {
        "status": "needs-verification",
        "source_refs": [
          "SRC-LB-MAN",
          "SRC-HYPOTHESIS-LAB"
        ],
        "notes": {
          "en": "Migrated from the v0.2 hypothesis registry as an independent hypothesis object.",
          "zh-Hans": "从 v0.2 假说登记表迁移为独立假说对象。"
        }
      },
      "ai_review": {
        "status": "not-reviewed",
        "reviewer": null,
        "reviewed_at": null,
        "rationale": {
          "en": "No G.1 object-level AI review has been completed.",
          "zh-Hans": "尚未完成 G.1 对象级 AI 审核。"
        }
      }
    },
    {
      "hypothesis_id": "UNI-W-WATER-002",
      "label": {
        "en": "W-family enrichment in WATER / WETNESS / WAVE-FLOW semantics",
        "zh-Hans": "W 词族在水／湿润／波动—流动语义中的富集假说"
      },
      "status": "Tested-Inconclusive",
      "source_refs": [
        "SRC-EXP-002-PRIMARY",
        "SRC-EXP-002-PAGE"
      ],
      "hypothesis_type": "initial-consonant-semantics",
      "identity": "author-hypothesis",
      "statement": {
        "en": "W-family enrichment in WATER / WETNESS / WAVE-FLOW semantics",
        "zh-Hans": "W 词族在水／湿润／波动—流动语义中的富集假说"
      },
      "evidence_refs": [
        "SRC-EXP-002-PRIMARY",
        "SRC-EXP-002-PAGE"
      ],
      "confidence": "low",
      "source_verification": {
        "status": "experiment-linked",
        "source_refs": [
          "SRC-EXP-002-PRIMARY",
          "SRC-EXP-002-PAGE"
        ],
        "notes": {
          "en": "Migrated from the v0.2 hypothesis registry as an independent hypothesis object.",
          "zh-Hans": "从 v0.2 假说登记表迁移为独立假说对象。"
        }
      },
      "ai_review": {
        "status": "not-reviewed",
        "reviewer": null,
        "reviewed_at": null,
        "rationale": {
          "en": "No G.1 object-level AI review has been completed.",
          "zh-Hans": "尚未完成 G.1 对象级 AI 审核。"
        }
      }
    },
    {
      "hypothesis_id": "UNI-W-FH-PHONETIC-001",
      "label": {
        "en": "Possible W ↔ F/H phonetic or consonantal relation",
        "zh-Hans": "W ↔ F/H 的可能语音或辅音关系"
      },
      "status": "Untested",
      "source_refs": [
        "SRC-G1-CALIBRATION"
      ],
      "hypothesis_type": "consonant-correspondence",
      "identity": "author-hypothesis",
      "statement": {
        "en": "The author proposes that W may correspond with F or H in the water ↔ 哗 comparison. No regular sound change is asserted.",
        "zh-Hans": "作者提出在 water ↔ 哗 的比较中，W 可能与 F 或 H 对应；此处不声称存在已证实的规律音变。"
      },
      "evidence_refs": [],
      "confidence": "low",
      "source_verification": {
        "status": "needs-verification",